{
  "schemaVersion": 1,
  "id": "depth-anything",
  "immutable": true,
  "route": "models/depth-anything/",
  "identity": {
    "hfId": "onnx-community/depth-anything-v2-small",
    "task": "depth-estimation",
    "backend": "webgpu"
  },
  "generatedAt": "2026-07-19T00:00:00Z",
  "author": "derive-conformance",
  "suiteHash": "sha256:a3bea405f3b999060100d35b64d0c2d24e2808f0a07cb57d5220c2cfd445bd47",
  "assertions": [
    {
      "id": "loads-clean",
      "category": "real-inference",
      "describe": "The model page loads and initialises its control UI with no uncaught errors on the page or console.",
      "kind": "console-clean",
      "deviceClass": "both"
    },
    {
      "id": "calls-real-inference",
      "category": "real-inference",
      "describe": "The demo source calls a REAL in-browser inference path (transformers.js pipeline / WebLLM engine / MediaPipe Tasks) — never a canned result.",
      "kind": "source",
      "deviceClass": "both",
      "test": {
        "pattern": "pipeline\\(|createModelLoader|CreateMLCEngine|FilesetResolver|\\.generate\\(|\\.transcribe|MediaPipe|reranker|extractor|classifier",
        "mode": "contains"
      }
    },
    {
      "id": "io-shape-semantic",
      "category": "io-shape",
      "describe": "Expected output shape + semantic sanity: a real run produces a per-pixel depth map visualised over the image.",
      "kind": "manual-evidenced",
      "deviceClass": "both"
    },
    {
      "id": "declares-model-id",
      "category": "runtime-config",
      "describe": "At-a-glance shows the exact source model id (onnx-community/depth-anything-v2-small) linked to its card — no invented model.",
      "kind": "page-text",
      "deviceClass": "both",
      "test": "onnx-community/depth-anything-v2-small"
    },
    {
      "id": "declares-task",
      "category": "runtime-config",
      "describe": "At-a-glance names the real pipeline task (depth-estimation).",
      "kind": "page-text",
      "deviceClass": "both",
      "test": "depth-estimation"
    },
    {
      "id": "declares-backend",
      "category": "runtime-config",
      "describe": "The page declares the execution backend (WebGPU).",
      "kind": "script",
      "deviceClass": "both",
      "test": "/webgpu|wasm/i.test(document.documentElement.innerText)"
    },
    {
      "id": "declares-quantisation",
      "category": "runtime-config",
      "describe": "At-a-glance states the quantisation/dtype (fp16) the demo actually loads.",
      "kind": "page-text",
      "deviceClass": "both",
      "test": "fp16"
    },
    {
      "id": "inference-off-main-thread",
      "category": "runtime-config",
      "describe": "Inference runs off the main thread (a Web Worker) so the control UI stays responsive and INP stays low.",
      "kind": "source",
      "deviceClass": "both",
      "test": {
        "pattern": "new Worker|worker\\.js",
        "mode": "contains"
      }
    },
    {
      "id": "shared-auto-init-loader",
      "category": "cache-init",
      "describe": "The page loads its model through the shared createModelLoader auto-init architecture — not a hand-rolled Load button.",
      "kind": "source",
      "deviceClass": "both",
      "test": {
        "pattern": "createModelLoader",
        "mode": "contains"
      }
    },
    {
      "id": "auto-init-on-cached",
      "category": "cache-init",
      "describe": "A valid current on-device model auto-initialises (checking → initialising → ready) with no Load click for a returning user; only Download/Re-download/Update surface otherwise.",
      "kind": "manual-evidenced",
      "deviceClass": "both"
    },
    {
      "id": "live-status-region",
      "category": "states",
      "describe": "Loading/progress/ready/error state is announced in an accessible live region (role=status, aria-live).",
      "kind": "dom",
      "deviceClass": "both",
      "test": {
        "selector": "[role=\"status\"][aria-live], [role=\"status\"]",
        "min": 1
      }
    },
    {
      "id": "errors-on-the-page",
      "category": "states",
      "describe": "Load/inference/WebGPU/memory failures surface on the page (an .err/error status the visitor can read), never only in the console.",
      "kind": "source",
      "deviceClass": "both",
      "test": {
        "pattern": "err|error|Retry|retry",
        "mode": "contains"
      }
    },
    {
      "id": "honest-progress-retry-offline",
      "category": "states",
      "describe": "Download progress, retry/recovery on failure, and cached offline use are handled honestly (no fake success, no silent large re-download).",
      "kind": "manual-evidenced",
      "deviceClass": "both"
    },
    {
      "id": "webgpu-capability-honest",
      "category": "states",
      "describe": "This model prefers WebGPU; on a device with no GPU adapter the page shows a labelled HONEST state — either the WASM-fallback/download path or a needs-WebGPU/unsupported explanation with enable steps — never a blank panel or faked output.",
      "kind": "capability",
      "deviceClass": "both",
      "test": {
        "probe": "webgpu"
      }
    },
    {
      "id": "controls-operable",
      "category": "controls",
      "describe": "Every visible control (inputs, buttons, samples, parameter widgets) is real, labelled, and keyboard-operable — no dead or decorative controls.",
      "kind": "manual-evidenced",
      "deviceClass": "both"
    },
    {
      "id": "no-fake-output",
      "category": "no-fake-output",
      "describe": "No canned/hardcoded result is presented as live model output; the visible output is produced by the on-device run (or an honest unsupported state).",
      "kind": "manual-evidenced",
      "deviceClass": "both"
    },
    {
      "id": "images-have-alt",
      "category": "accessibility",
      "describe": "All content images expose alternative text (or are marked decorative).",
      "kind": "script",
      "deviceClass": "both",
      "test": "Array.from(document.querySelectorAll('img')).every(i=>i.hasAttribute('alt'))"
    },
    {
      "id": "buttons-have-names",
      "category": "accessibility",
      "describe": "Every button exposes an accessible name (text, aria-label, or aria-labelledby).",
      "kind": "script",
      "deviceClass": "both",
      "test": "Array.from(document.querySelectorAll('button')).every(b=>((b.textContent||'').trim()||b.getAttribute('aria-label')||b.getAttribute('aria-labelledby')))"
    },
    {
      "id": "responsive-desktop",
      "category": "responsive",
      "describe": "At desktop (≈1280×800) the layout has no unintended horizontal overflow and no clipped controls/text.",
      "kind": "responsive",
      "deviceClass": "desktop",
      "test": {
        "assert": "no-horizontal-overflow"
      }
    },
    {
      "id": "responsive-mobile",
      "category": "responsive",
      "describe": "At narrow mobile (≈360×740, DPR3, touch) the layout has no horizontal overflow, legible text, and ≈44px tap targets.",
      "kind": "responsive",
      "deviceClass": "mobile",
      "test": {
        "assert": "no-horizontal-overflow"
      }
    },
    {
      "id": "parity-both-classes",
      "category": "responsive",
      "describe": "The demo is a usable, polished experience on BOTH mobile and desktop, or is honestly recorded unsupported on a class with evidence (never left unfinished).",
      "kind": "manual-evidenced",
      "deviceClass": "both"
    },
    {
      "id": "inp-stays-low",
      "category": "performance",
      "describe": "Interacting with the controls keeps the main thread responsive (inference off-thread, long tasks broken up) — no INP regression from a blocking loop.",
      "kind": "manual-evidenced",
      "deviceClass": "both"
    },
    {
      "id": "guidance-consulted",
      "category": "build-process",
      "describe": "The frontend implementation consulted modern-web-guidance for its UI/API topics and applied or justified the recommendations (recorded in the critique's guidanceConsulted).",
      "kind": "manual-evidenced",
      "deviceClass": "both"
    },
    {
      "id": "worker-compliance",
      "category": "performance",
      "describe": "The dense-output depth-colourise composite runs OFF the main thread: the per-pixel colour-map loop executes in models/depth-anything/worker.js on an OffscreenCanvas and the result is transferToImageBitmap'd back, so the main thread only does a drawImage. Colour-map switches recolour via the worker (engine.recolor) too — no getImageData→per-pixel→putImageData loop remains on the main thread.",
      "kind": "source",
      "deviceClass": "both",
      "test": {
        "pattern": "transferToImageBitmap|OffscreenCanvas|recolor",
        "mode": "contains"
      }
    }
  ]
}
